{
  "meta": {
    "schema_version": "project-context/1.1",
    "context_id": "ctx_harness-project_5e7b",
    "context_hash": "sha256:a7ba9840b5402cd4dd0a619a076bcf88d6dff9e3c9acc08c31c71562c4d50d53",
    "generated_at": "2026-08-28T22:28:07-03:00",
    "initiator_version": "harness/0.13.0",
    "repo_revision": "5e7b4437e0851b2ee64269d7a510bf689118b991",
    "docs_revision": "sha256:9780095ded6347631eeed3f8ff21677f60519df998bc232460d1e4915feff19f"
  },
  "project_profile": {
    "project_id": "harness-project",
    "project_name": "harness-project",
    "project_type": "cli",
    "purpose": "La fábrica del harness del GCBA. Produce, versiona y reparte el harness de Claude Code que después se instala sobre los proyectos: los cuatro hooks, los checks, las skills y los agentes de cada harness. Cada versión que sale de acá hay que volver a instalarla donde el harness ya está en uso.",
    "lifecycle_stage": "production",
    "knowledge_status": "confirmed"
  },
  "sources": [
    {
      "source_id": "code:checks",
      "type": "code",
      "location": "comun/checks/claude-md-zonas.py",
      "revision": "5e7b4437e0851b2ee64269d7a510bf689118b991",
      "discovered_at": "2026-08-22T11:59:22-03:00",
      "authority_scope": "implementación observada del módulo",
      "status": "current"
    },
    {
      "source_id": "code:comun-agentes-y-skills",
      "type": "functional_doc",
      "location": "comun/agents/flush-memoria.md",
      "revision": "5e7b4437e0851b2ee64269d7a510bf689118b991",
      "discovered_at": "2026-08-22T11:59:22-03:00",
      "authority_scope": "implementación observada del módulo",
      "status": "current"
    },
    {
      "source_id": "code:comun-hooks",
      "type": "code",
      "location": "comun/hooks/session-start.py",
      "revision": "5e7b4437e0851b2ee64269d7a510bf689118b991",
      "discovered_at": "2026-08-22T11:59:22-03:00",
      "authority_scope": "implementación observada del módulo",
      "status": "current"
    },
    {
      "source_id": "code:docs-cambios",
      "type": "functional_doc",
      "location": "docs/cambios/hooks-en-python/",
      "revision": "5e7b4437e0851b2ee64269d7a510bf689118b991",
      "discovered_at": "2026-08-22T11:59:22-03:00",
      "authority_scope": "implementación observada del módulo",
      "status": "current"
    },
    {
      "source_id": "code:docs-versiones",
      "type": "functional_doc",
      "location": "CHANGELOG.md",
      "revision": "5e7b4437e0851b2ee64269d7a510bf689118b991",
      "discovered_at": "2026-08-22T11:59:22-03:00",
      "authority_scope": "implementación observada del módulo",
      "status": "current"
    },
    {
      "source_id": "code:docs",
      "type": "functional_doc",
      "location": "README.md",
      "revision": "5e7b4437e0851b2ee64269d7a510bf689118b991",
      "discovered_at": "2026-08-22T11:59:22-03:00",
      "authority_scope": "implementación observada del módulo",
      "status": "current"
    },
    {
      "source_id": "code:fabrica",
      "type": "functional_doc",
      "location": "CLAUDE.md",
      "revision": "5e7b4437e0851b2ee64269d7a510bf689118b991",
      "discovered_at": "2026-08-22T11:59:22-03:00",
      "authority_scope": "implementación observada del módulo",
      "status": "current"
    },
    {
      "source_id": "code:harnesses-analisis",
      "type": "config",
      "location": "harnesses/analisis/manifest.json",
      "revision": "5e7b4437e0851b2ee64269d7a510bf689118b991",
      "discovered_at": "2026-08-22T11:59:22-03:00",
      "authority_scope": "implementación observada del módulo",
      "status": "current"
    },
    {
      "source_id": "code:harnesses-desarrollo",
      "type": "config",
      "location": "harnesses/desarrollo/manifest.json",
      "revision": "5e7b4437e0851b2ee64269d7a510bf689118b991",
      "discovered_at": "2026-08-22T11:59:22-03:00",
      "authority_scope": "implementación observada del módulo",
      "status": "current"
    },
    {
      "source_id": "code:install",
      "type": "code",
      "location": "install.ps1",
      "revision": "5e7b4437e0851b2ee64269d7a510bf689118b991",
      "discovered_at": "2026-08-22T11:59:22-03:00",
      "authority_scope": "implementación observada del módulo",
      "status": "current"
    },
    {
      "source_id": "code:normativa",
      "type": "functional_doc",
      "location": "normativa/extractos/ES0901.md",
      "revision": "5e7b4437e0851b2ee64269d7a510bf689118b991",
      "discovered_at": "2026-08-22T11:59:22-03:00",
      "authority_scope": "implementación observada del módulo",
      "status": "current"
    },
    {
      "source_id": "code:terceros",
      "type": "config",
      "location": "terceros/terceros.lock.json",
      "revision": "5e7b4437e0851b2ee64269d7a510bf689118b991",
      "discovered_at": "2026-08-22T11:59:22-03:00",
      "authority_scope": "implementación observada del módulo",
      "status": "current"
    },
    {
      "source_id": "code:tests",
      "type": "tests",
      "location": "tests/Invoke-Tests.ps1",
      "revision": "5e7b4437e0851b2ee64269d7a510bf689118b991",
      "discovered_at": "2026-08-22T11:59:22-03:00",
      "authority_scope": "implementación observada del módulo",
      "status": "current"
    },
    {
      "source_id": "config:tests/fixtures/proyecto-checks/package.json",
      "type": "config",
      "location": "tests/fixtures/proyecto-checks/package.json",
      "revision": "5e7b4437e0851b2ee64269d7a510bf689118b991",
      "discovered_at": "2026-08-22T11:59:22-03:00",
      "authority_scope": "contrato declarado",
      "status": "current"
    },
    {
      "source_id": "adr:docs/adr/0001-rama-de-desarrollo-se-llama-develop.md",
      "type": "adr",
      "location": "docs/adr/0001-rama-de-desarrollo-se-llama-develop.md",
      "revision": "5e7b4437e0851b2ee64269d7a510bf689118b991",
      "discovered_at": "2026-08-22T11:59:22-03:00",
      "authority_scope": "decisión vigente de arquitectura",
      "status": "current"
    },
    {
      "source_id": "adr:docs/adr/0002-copia-en-vez-de-symlink.md",
      "type": "adr",
      "location": "docs/adr/0002-copia-en-vez-de-symlink.md",
      "revision": "5e7b4437e0851b2ee64269d7a510bf689118b991",
      "discovered_at": "2026-08-22T11:59:22-03:00",
      "authority_scope": "decisión vigente de arquitectura",
      "status": "current"
    },
    {
      "source_id": "adr:docs/adr/0003-obsidian-fuera-del-harness.md",
      "type": "adr",
      "location": "docs/adr/0003-obsidian-fuera-del-harness.md",
      "revision": "5e7b4437e0851b2ee64269d7a510bf689118b991",
      "discovered_at": "2026-08-22T11:59:22-03:00",
      "authority_scope": "decisión vigente de arquitectura",
      "status": "current"
    },
    {
      "source_id": "adr:docs/adr/0004-el-harness-no-usa-source.md",
      "type": "adr",
      "location": "docs/adr/0004-el-harness-no-usa-source.md",
      "revision": "5e7b4437e0851b2ee64269d7a510bf689118b991",
      "discovered_at": "2026-08-22T11:59:22-03:00",
      "authority_scope": "decisión vigente de arquitectura",
      "status": "current"
    },
    {
      "source_id": "adr:docs/adr/0005-terceros-separados-de-lo-propio.md",
      "type": "adr",
      "location": "docs/adr/0005-terceros-separados-de-lo-propio.md",
      "revision": "5e7b4437e0851b2ee64269d7a510bf689118b991",
      "discovered_at": "2026-08-22T11:59:22-03:00",
      "authority_scope": "decisión vigente de arquitectura",
      "status": "current"
    },
    {
      "source_id": "adr:docs/adr/0006-sdd-como-metodo-de-los-proyectos.md",
      "type": "adr",
      "location": "docs/adr/0006-sdd-como-metodo-de-los-proyectos.md",
      "revision": "5e7b4437e0851b2ee64269d7a510bf689118b991",
      "discovered_at": "2026-08-22T11:59:22-03:00",
      "authority_scope": "decisión vigente de arquitectura",
      "status": "current"
    },
    {
      "source_id": "adr:docs/adr/0008-lo-externo-nunca-es-requisito.md",
      "type": "adr",
      "location": "docs/adr/0008-lo-externo-nunca-es-requisito.md",
      "revision": "5e7b4437e0851b2ee64269d7a510bf689118b991",
      "discovered_at": "2026-08-22T11:59:22-03:00",
      "authority_scope": "decisión vigente de arquitectura",
      "status": "current"
    },
    {
      "source_id": "adr:docs/adr/0009-un-escenario-sobre-un-modelo-se-verifica-por-lectura.md",
      "type": "adr",
      "location": "docs/adr/0009-un-escenario-sobre-un-modelo-se-verifica-por-lectura.md",
      "revision": "5e7b4437e0851b2ee64269d7a510bf689118b991",
      "discovered_at": "2026-08-22T11:59:22-03:00",
      "authority_scope": "decisión vigente de arquitectura",
      "status": "current"
    }
  ],
  "technology": {
    "languages": [
      "Python",
      "PowerShell"
    ],
    "frameworks": [],
    "runtimes": [
      "Python 3.9 o mayor",
      "Windows PowerShell 5.1"
    ],
    "package_managers": [],
    "build_commands": [
      ".\\install.ps1 -Project <ruta> -Harness desarrollo",
      ".\\install.ps1 -Project <ruta> -Update",
      ".\\install.ps1 -Project <ruta> -Doctor"
    ],
    "test_commands": [
      ".\\tests\\Invoke-Tests.ps1",
      "python tests/correr.py"
    ],
    "knowledge_status": "confirmed"
  },
  "architecture": {
    "components": [
      {
        "component_id": "checks",
        "name": "checks",
        "responsibility": "Las reglas que corren después de cada escritura y avisan cuando algo no cumple una norma. Son cinco, todas con el mismo contrato: un `.py` que expone `verificar(evento, proyecto, config)` y devuelve cero o más strings, uno por hallazgo. Silencio cuando está todo bien. **Ninguno bloquea.** Lo único que este harness bloquea son los secretos, y eso pasa antes, en el hook de `PreToolUse`. Un check acá llegaría tarde y con menos autoridad. Uno lo aporta `comun/` y cuatro los aporta el harness `desarrollo`; se agrupan juntos porque comparten contrato, presupuesto y la misma regla de diseño: salir temprano.",
        "source_refs": [